{
  "name": "Thủ tục đăng ký hộ kinh doanh",
  "name_en": "Household business registration",
  "domain": "business",
  "target_audience": ["individual", "household"],
  "responsible_authority": "Bộ Tài chính",
  "implementing_authority": "Cơ quan đăng ký kinh doanh cấp xã nơi đặt địa điểm kinh doanh",
  "jurisdiction": "commune",
  "eligibility": "Cá nhân, thành viên hộ gia đình đủ năng lực hành vi dân sự, đăng ký kinh doanh tại một địa điểm",
  "prerequisites": [],
  "required_documents": [
    {
      "name": "Giấy đề nghị đăng ký hộ kinh doanh",
      "description": "Theo mẫu ban hành kèm Nghị định 01/2021/NĐ-CP",
      "copies": 1,
      "form_code": "giay-de-nghi-dk-hkd"
    },
    {
      "name": "Bản sao giấy tờ pháp lý của cá nhân",
      "description": "Đối với chủ hộ kinh doanh và các thành viên hộ gia đình đăng ký (trường hợp nộp trực tiếp có thể xuất trình bản chính)",
      "copies": 1
    },
    {
      "name": "Bản sao biên bản họp thành viên hộ gia đình",
      "description": "Chỉ trong trường hợp các thành viên hộ gia đình cùng đăng ký",
      "copies": 1
    }
  ],
  "steps": [
    {
      "order": 1,
      "name": "Nộp hồ sơ",
      "description": "Người thành lập hộ kinh doanh nộp hồ sơ tại cơ quan đăng ký kinh doanh cấp xã hoặc qua dịch vụ bưu chính / trực tuyến"
    },
    {
      "order": 2,
      "name": "Tiếp nhận và kiểm tra",
      "description": "Cơ quan đăng ký kiểm tra tính hợp lệ của hồ sơ; trường hợp chưa hợp lệ ra thông báo yêu cầu sửa đổi, bổ sung"
    },
    {
      "order": 3,
      "name": "Cấp Giấy xác nhận",
      "description": "Trong thức hạn 03 ngày làm việc kể từ ngày nhận hồ sơ hợp lệ, cấp Giấy xác nhận về việc đăng ký hộ kinh doanh"
    }
  ],
  "submission_channels": ["in-person", "postal", "online"],
  "processing_time": "03 ngày làm việc kể từ ngày nhận hồ sơ hợp lệ",
  "fees": [
    {
      "name": "Lệ phí đăng ký hộ kinh doanh",
      "amount_vnd": null,
      "notes": "Theo mức thu hiện hành của HĐND cấp tỉnh theo thẩm quyền phí, lệ phí — verify against current fee schedule before publishing"
    }
  ],
  "official_forms": ["giay-de-nghi-dk-hkd"],
  "expected_outputs": ["Giấy xác nhận về việc đăng ký hộ kinh doanh"],
  "legal_basis": ["Nghị định 01/2021/NĐ-CP về đăng ký doanh nghiệp"],
  "valid_from": null,
  "valid_to": null,
  "official_url": "https://dichvucong.gov.vn/",
  "provenance": {
    "source_id": "gov-dvc",
    "source_url": "https://dichvucong.gov.vn/",
    "retrieved_at": "2026-07-27T00:00:00Z",
    "retrieval_method": "manual",
    "license_status": "reference-only",
    "confidence": "partial",
    "notes": "Phase 0 illustrative example, hand-drafted from Nghị định 01/2021/NĐ-CP structure. National TTHC code deliberately omitted (never invent). After the 2025 two-tier local-government reform, household business registration sits at commune level — implementing_authority wording to be verified against the current national TTHC database before this record leaves example status."
  }
}
